[
  {
    "event_version": "1.0.0-draft",
    "event_id": "sess_demo_event_log_001:source:src_001:1",
    "session_id": "sess_demo_event_log_001",
    "kind": "source",
    "recorded_at": "2026-04-22T00:00:00Z",
    "order": 1,
    "idempotency_key": "source-src_001",
    "data": {
      "source_id": "src_001",
      "source_type": "scripture",
      "title": "Mosiah 3:19",
      "canonical_ref": "Book of Mormon / Mosiah 3:19",
      "display_text": "The natural man is an enemy to God unless he yields to the Spirit.",
      "visibility": "public"
    }
  },
  {
    "event_version": "1.0.0-draft",
    "event_id": "sess_demo_event_log_001:prompt:prompt_001:2",
    "session_id": "sess_demo_event_log_001",
    "kind": "prompt",
    "recorded_at": "2026-04-22T00:00:10Z",
    "order": 2,
    "data": {
      "prompt_id": "prompt_001",
      "prompt_type": "user_creation_prompt",
      "visibility": "public",
      "text": "Turn this scripture into a short, encouraging vertical video.",
      "created_by": "user",
      "created_at": "2026-04-22T00:00:09Z"
    }
  },
  {
    "event_version": "1.0.0-draft",
    "event_id": "sess_demo_event_log_001:tool:tool_script_001:3",
    "session_id": "sess_demo_event_log_001",
    "kind": "tool",
    "recorded_at": "2026-04-22T00:00:15Z",
    "order": 3,
    "data": {
      "tool_id": "tool_script_001",
      "tool_type": "language_model",
      "provider": "example-provider",
      "model_identifier": "example-model-1",
      "purpose": "script_generation",
      "human_oversight_level": "human_validated"
    }
  },
  {
    "event_version": "1.0.0-draft",
    "event_id": "sess_demo_event_log_001:generation:gen_001:4",
    "session_id": "sess_demo_event_log_001",
    "kind": "generation",
    "recorded_at": "2026-04-22T00:00:20Z",
    "order": 4,
    "data": {
      "generation_event_id": "gen_001",
      "tool_id": "tool_script_001",
      "prompt_ids": ["prompt_001"],
      "source_ids": ["src_001"],
      "created_at": "2026-04-22T00:00:19Z"
    }
  },
  {
    "event_version": "1.0.0-draft",
    "event_id": "sess_demo_event_log_001:segment:seg_001:5",
    "session_id": "sess_demo_event_log_001",
    "kind": "segment",
    "recorded_at": "2026-04-22T00:00:30Z",
    "order": 5,
    "data": {
      "segment_id": "seg_001",
      "time_range": {
        "start": 0,
        "end": 7.5
      },
      "visible_text": "This clip turns a scripture into a short hopeful invitation to change.",
      "narration_text": "This clip turns a scripture into a short hopeful invitation to change.",
      "claim_type": "summary",
      "source_ids": ["src_001"],
      "prompt_ids": ["prompt_001"],
      "generation_event_ids": ["gen_001"],
      "edit_event_ids": [],
      "guardrail_event_ids": []
    }
  },
  {
    "event_version": "1.0.0-draft",
    "event_id": "sess_demo_event_log_001:guardrail:guard_001:6",
    "session_id": "sess_demo_event_log_001",
    "kind": "guardrail",
    "recorded_at": "2026-04-22T00:00:35Z",
    "order": 6,
    "data": {
      "guardrail_event_id": "guard_001",
      "policy_profile": "org.vvmp.demo",
      "policy_version": "0.1.0",
      "check_type": "source_grounding",
      "target_type": "script_segment",
      "target_id": "seg_001",
      "verdict": "approved",
      "risk_level": "low",
      "public_summary": "Segment stayed aligned with the cited scripture source.",
      "review_mode": "automated"
    }
  }
]
